{
    "borrowers": [
        {
            "name": "Borrower 1",
            "entityType": "individual"
        },
        {
            "name": "Borrower 2",
            "entityType": "limited liability company",
            "formationState": "California",
            "signer": "Mr. Signer",
            "signerTitle": "President"
        }
    ],
    "collateralProperties": [
        {
            "street": "First Collateral Property",
            "city": "CP1 City",
            "state": "California",
            "zip": "22222",
            "county": "Pickens",
            "owners": [
                {
                    "owner": "Borrower 1",
                    "vesting": "a single man"
                }
            ]
        },
        {
            "street": "Second Collateral Property",
            "city": "CP2 City",
            "state": "California",
            "zip": "33333",
            "county": "Pickens",
            "owners": [
                {
                    "owner": "Borrower 1",
                    "vesting": "a single man"
                },
                {
                    "owner": "Borrower 2"
                }
            ]
        }
    ],
    "lenderContact": {
        "street": "Lender Street",
        "city": "Lender City",
        "state": "California",
        "zip": "11111",
        "name": "Lender Bank, LLC"
    },
    "interest": {
        "rate": 6.125,
        "ioPeriod": 12
    },
    "loan": {
        "loanNumber": "LoanNumber115",
        "closingDate": "2023-09-10",
        "loanTerm": 120,
        "loanAmount": 350000
    }
}